<?xml version="1.0"?>
<!DOCTYPE oomap SYSTEM "oomap.dtd">

<oomap name="One node to rule them all" width="40" height="30" difficulty="normal">
	<author>Philipp Nordhus</author>
	<name lang="de">Ein Knoten, sie zu knechten</name>
	
	<spawn x="10" y="2" />
	<spawn x="15" y="2" />
	<spawn x="25" y="2" />
	<spawn x="30" y="2" />
	
	<spawn x="12.5" y="4" />
	<spawn x="17.5" y="4" />
	<spawn x="22.5" y="4" />
	<spawn x="27.5" y="4" />
	
	<node x="20" y="15" />
</oomap>
