<?xml version="1.0"?>
<!DOCTYPE oomap SYSTEM "oomap.dtd">

<oomap name="SCUMM Bar" width="60" height="40">
	<spawn x="13.75" y="2.5" />
	<spawn x="21.25" y="2.5" />
	<spawn x="28.75" y="2.5" />
	<spawn x="36.25" y="2.5" />
	
	<spawn x="10" y="7.5" />
	<spawn x="17.5" y="7.5" />
	<spawn x="32.5" y="7.5" />
	<spawn x="40" y="7.5" />
	
	<node x="20" y="20" />
	<node x="40" y="20" />
	
	<bouncer x1="25" y1="20" x2="35" y2="20" width="0.5" boost="2" />
</oomap>
