<?xml version="1.0"?>
<!DOCTYPE oomap SYSTEM "oomap.dtd">

<oomap name="Four Traps" width="40" height="40">
	<author>Bernd HÃ¼gel</author>
	<name lang="de">Vier Fallen</name>
	
	<spawn x="10" y="2" />
	<spawn x="15" y="2" />
	<spawn x="25" y="2" />
	<spawn x="30" y="2" />
	
	<spawn x="12.5" y="4" />
	<spawn x="17.5" y="4" />
	<spawn x="22.5" y="4" />
	<spawn x="27.5" y="4" />
	
	<node x="20" y="20" />
	
	<bouncer x1="10" y1="0" x2="30" y2="0" width="0.5" boost="1" unlink="false" />
	<bouncer x1="10" y1="0" x2="15" y2="5" width="0.5" boost="1" unlink="false" />
	<bouncer x1="30" y1="0" x2="25" y2="5" width="0.5" boost="1" unlink="false" />
	
	<bouncer x1="10" y1="40" x2="30" y2="40" width="0.5" boost="1" unlink="false" />
	<bouncer x1="10" y1="40" x2="15" y2="35" width="0.5" boost="1" unlink="false" />
	<bouncer x1="30" y1="40" x2="25" y2="35" width="0.5" boost="1" unlink="false" />
	
	<bouncer x1="0" y1="10" x2="0" y2="30" width="0.5" boost="1" unlink="false" />
	<bouncer x1="0" y1="10" x2="5" y2="15" width="0.5" boost="1" unlink="false" />
	<bouncer x1="0" y1="30" x2="5" y2="25" width="0.5" boost="1" unlink="false" />
	
	<bouncer x1="40" y1="10" x2="40" y2="30" width="0.5" boost="1" unlink="false" />
	<bouncer x1="40" y1="10" x2="35" y2="15" width="0.5" boost="1" unlink="false" />
	<bouncer x1="40" y1="30" x2="35" y2="25" width="0.5" boost="1" unlink="false" />
</oomap>
