<?xml version="1.0"?>
<!DOCTYPE oomap SYSTEM "oomap.dtd">

<oomap name="Double" width="50" height="37.5">
	<author>Philipp Nordhus</author>
	<name lang="de">Doppelt h√§lt besser</name>
	
	<spawn x="13.75" y="2.5" />
	<spawn x="21.25" y="2.5" />
	<spawn x="28.75" y="2.5" />
	<spawn x="36.25" y="2.5" />
	
	<spawn x="10" y="7.5" />
	<spawn x="17.5" y="7.5" />
	<spawn x="32.5" y="7.5" />
	<spawn x="40" y="7.5" />
	
	<node x="18.75" y="12.5" />
	<node x="31.25" y="25" />
</oomap>
