<?xml version="1.0"?>
<!DOCTYPE oomap SYSTEM "oomap.dtd">

<oomap name="Left Dead-point" width="60" height="40" difficulty="normal">
	<author>Bernd HÃ¼gel</author>
	<name lang="de">Todespunkt: Links</name>
	
	<spawn x="10" y="2" />
	<spawn x="15" y="2" />
	<spawn x="25" y="2" />
	<spawn x="30" y="2" />
	
	<spawn x="12.5" y="4" />
	<spawn x="17.5" y="4" />
	<spawn x="22.5" y="4" />
	<spawn x="27.5" y="4" />
	
	<node x="5" y="20" />
	<node x="40" y="20" />
	
	<bouncer x1="0" y1="0" x2="0" y2="40" width="0.5" boost="5" unlink="false" />
	<bouncer x1="20" y1="40" x2="40" y2="40" width="0.5" boost="3" />
	<bouncer x1="50" y1="40" x2="60" y2="40" width="0.5" boost="3" />
	<bouncer x1="60" y1="30" x2="60" y2="40" width="0.5" boost="3" />
</oomap>
